### ISSUE TITLE
IO delays with NVMe/TCP

### ISSUE THREAD

**Issue by ashish19121** [spdk/spdk#1377]
NVMe/TCP socket low watermark set to sizeof(spdk_nvme_tcp_c2h_data_hdr). Because of this if any data of size less than sizeof(spdk_nvme_tcp_c2h_data_hdr) sent to target delays IO processing of the command.

## Expected Behavior

Faster IO processing

## Current Behavior

Delayed IO processing

## Possible Solution

NVMe/TCP socket low watermark should be set to sizeof(spdk_nvme_tcp_common_pdu_hdr) i.e. common PDU header.

## Steps to Reproduce
Sending write command with in-capsule payload (4096) bytes

Packet trace:
[First segment, seq = 1611385 (len 72) ==> Next seq number ==> 1611385 + 72 ==> 1611457 (Next segment)
28270 73.901968 192.168.30.10 192.168.30.200 TCP 138 25996 → 4420 [PSH, ACK] Seq=1611385 Ack=6502889 Win=164864 Len=72 TSval=4136024873 TSecr=78660523 [TCP segment of a reassembled PDU]

[Second segment, seq = 1611457 (len 4080) ==> Next seq number ==> 1611457 + 4080 ==> 1615537 (Last segment)
28271 73.902017 192.168.30.10 192.168.30.200 TCP 4146 25996 → 4420 [PSH, ACK] Seq=1611457 Ack=6502889 Win=164864 Len=4080 TSval=4136024873 TSecr=78660523 [TCP segment of a reassembled PDU]

[Acknowledgement received for both segments above] ==> Ack = 1615537 indicating both above segments received.
28272 73.902138 192.168.30.200 192.168.30.10 TCP 66 4420 → 25996 [ACK] Seq=6502889 Ack=1615537 Win=211532 Len=0 TSval=78660531 TSecr=4136024873

[Last segment of Write command] As expected seq number ==> 1615537
28273 73.902186 192.168.30.10 192.168.30.200 NVMe 82 NVMe Write | NVMe Write: Data  Seq=1615537 Len=16

[Acknowledgement of last segment] As expected ack number ==> 1615553 (1615537 + 16)
28274 73.945070 192.168.30.200 192.168.30.10 TCP 66 4420 → 25996 [ACK] Seq=6502889 Ack=1615553 Win=211532 Len=0 TSval=78660574 TSecr=4136024873

Response of command completion: Seq number 6502889 (same as above), 
28371 82.734345 192.168.30.200 192.168.30.10 NVMe 90 NVMe Write: Response Seq = 6502889, Ack = 1616721

In the above trace we can see command completion happened after 8s. This is because last packet of write request is 16 bytes and even though TCP stack acknowledged receiving it, it was not reported to NVMe/TCP stack as watermark is set to 24 bytes. Here command completed after 8s because another command was sent which helped to reach the watermark for socket.

## Context (Environment including OS version, SPDK version, etc.)
SPDK top of the tree version.

**Comment by liu-wenhua** [comment]
To address the issue, we made the following change:

*** tcp.c.new   2020-04-30 05:31:37.196499792 +0000
--- tcp.c       2020-04-29 19:48:25.857651523 +0000
*************** spdk_nvmf_tcp_qpair_sock_init(struct spd
*** 911,917 ****
        int rc;
  
        /* set low water mark */
!       rc = spdk_sock_set_recvlowat(tqpair->sock, sizeof(struct spdk_nvme_tcp_common_pdu_hdr));
        if (rc != 0) {
                SPDK_ERRLOG("spdk_sock_set_recvlowat() failed\n");
                return rc;
--- 911,917 ----
        int rc;
  
        /* set low water mark */
!       rc = spdk_sock_set_recvlowat(tqpair->sock, sizeof(struct spdk_nvme_tcp_c2h_data_hdr));
        if (rc != 0) {
                SPDK_ERRLOG("spdk_sock_set_recvlowat() failed\n");
                return rc;

**Comment by optimistyzy** [comment]
@liu-wenhua @tomzawadzki   Wenhua submitted the following patch:
https://review.spdk.io/gerrit/c/spdk/spdk/+/2138
It can address this issue.

**Comment by optimistyzy** [comment]
I will close this issue since this patch is merged. @liu-wenhua @tomzawadzki   Thanks for Wenhua's bug report and the patch submission.
